place_name,phone_number,verified,details
ADVOCATE HEALTH AND HOSPITALS,630-990 5192,False,
CATHOLIC CHARITIES OF THE ARCHDIOCESE OF CHICAGO,312-655-7573,True,"{'formatted_address': '721 N La Salle Dr, Chicago, IL 60654, United States', 'name': 'Catholic Charities', 'place_id': 'ChIJw6_lrswsDogRrstRisYXFac'}"
COMMUNITY ADULT DAY CENTER,630-968 1060,False,
"EUROPEAN SERVICES AT HOME, INC",847-202 1249,False,
HEART TO HEART SERVICES INC,708-534 6454,False,
HUMAN RESOURCES OF EDGAR AND CLARK COUNTIES,217-465-4118,False,
PRESENCE LIFE CONNECTIONS,815-232-6181,False,
